{
  "plan_file": "docs/planning/voice-agent-and-personalization-plan.xml",
  "plan_version": "1.0",
  "execution_mode": "autonomous",
  "current_task_id": null,
  "current_phase": null,
  "inner_iteration": 0,
  "tasks": {},
  "deferred_tasks": [],
  "convergence": {
    "reached": false,
    "tasks_done": 0,
    "tasks_total": 24,
    "tasks_stuck": 0,
    "tasks_deferred": 0
  },
  "session_task_count": 0,
  "session_inner_iterations": 0,
  "session_start": "2026-02-20T19:00:00Z"
}
