{
  "plan_file": "docs/planning/frontend-perf-iteration-plan.xml",
  "plan_version": "2.0",
  "execution_mode": "autonomous",
  "current_task_id": null,
  "current_phase": "PLAN_COMPLETE",
  "inner_iteration": 0,
  "session_task_count": 12,
  "session_inner_iterations": 12,
  "session_start": "2026-02-15T14:45:00Z",
  "tasks": {
    "H1": { "status": "DONE", "name": "Dynamic import PostHog", "inner_iterations": 1, "commit_hashes": ["1972052"], "test_count": 5, "completed_at": "2026-02-15T12:00:00Z" },
    "H2": { "status": "DONE", "name": "Dynamic import CopilotKit", "inner_iterations": 1, "commit_hashes": ["1972052"], "test_count": 3, "completed_at": "2026-02-15T12:00:00Z" },
    "H3": { "status": "DONE", "name": "Expand optimizePackageImports", "inner_iterations": 1, "commit_hashes": ["1972052"], "test_count": 0, "completed_at": "2026-02-15T12:00:00Z" },
    "H4": { "status": "DONE", "name": "Enable Turbopack", "inner_iterations": 1, "commit_hashes": ["1972052"], "test_count": 0, "completed_at": "2026-02-15T12:00:00Z" },
    "H5": { "status": "DONE", "name": "Add Jotai Provider", "inner_iterations": 1, "commit_hashes": ["1972052"], "test_count": 3, "completed_at": "2026-02-15T12:00:00Z" },
    "H6": { "status": "DONE", "name": "Remove feTurbulence", "inner_iterations": 1, "commit_hashes": ["1972052"], "test_count": 1, "completed_at": "2026-02-15T12:00:00Z" },
    "T7": { "status": "DONE", "name": "Install @next/bundle-analyzer", "inner_iterations": 1, "commit_hashes": [], "test_count": 0, "completed_at": "2026-02-15T14:50:00Z", "source_files": ["frontend/next.config.ts", "frontend/package.json"], "deps_added": ["@next/bundle-analyzer"] },
    "T8": { "status": "DONE", "name": "Enable React Compiler", "inner_iterations": 1, "commit_hashes": [], "test_count": 0, "completed_at": "2026-02-15T14:50:00Z", "source_files": ["frontend/next.config.ts"], "deps_added": ["babel-plugin-react-compiler"] },
    "T9": { "status": "DONE", "name": "Implement LazyMotion", "inner_iterations": 2, "commit_hashes": [], "test_count": 0, "completed_at": "2026-02-15T14:53:00Z", "source_files": ["frontend/src/app/page.tsx", "frontend/src/__tests__/landing-hero.test.tsx", "frontend/src/__tests__/landing-sections.test.tsx"] },
    "T10": { "status": "DONE", "name": "Fix var(--text-*) in confidence-gauge", "inner_iterations": 1, "commit_hashes": [], "test_count": 0, "completed_at": "2026-02-15T14:51:00Z", "source_files": ["frontend/src/components/confidence/confidence-gauge.tsx"] },
    "T11": { "status": "DONE", "name": "Precompute waveform inline styles", "inner_iterations": 1, "commit_hashes": [], "test_count": 0, "completed_at": "2026-02-15T14:51:00Z", "source_files": ["frontend/src/app/page.tsx"] },
    "T12": { "status": "DONE", "name": "Add image sizes attributes", "inner_iterations": 1, "commit_hashes": [], "test_count": 0, "completed_at": "2026-02-15T14:51:00Z", "source_files": ["frontend/src/app/page.tsx", "frontend/src/components/citations/citation-overlay.tsx"] },
    "T13": { "status": "DONE", "name": "Fix Set spread anti-pattern", "inner_iterations": 1, "commit_hashes": [], "test_count": 0, "completed_at": "2026-02-15T14:51:00Z", "source_files": ["frontend/src/app/review/page.tsx"] },
    "T14": { "status": "DONE", "name": "Convert .find() to Map lookups", "inner_iterations": 1, "commit_hashes": [], "test_count": 0, "completed_at": "2026-02-15T14:51:00Z", "source_files": ["frontend/src/app/page.tsx"] },
    "T15": { "status": "DONE", "name": "Tab-level code splitting — permissions", "inner_iterations": 1, "commit_hashes": [], "test_count": 0, "completed_at": "2026-02-15T14:52:00Z", "source_files": ["frontend/src/app/permissions/page.tsx"] },
    "T16": { "status": "DONE", "name": "Tab-level code splitting — review", "inner_iterations": 1, "commit_hashes": [], "test_count": 0, "completed_at": "2026-02-15T14:52:00Z", "source_files": ["frontend/src/app/review/page.tsx"] },
    "T17": { "status": "DONE", "name": "CSS containment for sticky images", "inner_iterations": 1, "commit_hashes": [], "test_count": 0, "completed_at": "2026-02-15T14:51:00Z", "source_files": ["frontend/src/app/page.tsx"] },
    "T18": { "status": "DONE", "name": "Verify all tests pass + build succeeds", "inner_iterations": 1, "commit_hashes": [], "test_count": 362, "completed_at": "2026-02-15T14:53:00Z", "test_results": [{"iteration": 1, "pass": 362, "fail": 0, "errors": 0, "lint_issues": 0, "type_errors": 0, "overall": "ALL_GREEN"}] }
  },
  "deferred_tasks": ["D1", "D2", "D3", "D4"],
  "convergence": {
    "reached": true,
    "tasks_done": 18,
    "tasks_total": 18,
    "tasks_stuck": 0,
    "tasks_deferred": 4,
    "total_tests": 362,
    "all_non_deferred_complete": true
  }
}
